{
  "id": "shop_private_tile_drop",
  "slug": "private-tile-drop",
  "title": "Private Tile Patron Drop",
  "description": "Reserved experimental tile listing for future protected releases.",
  "category": "giftables",
  "price": {
    "amount": 190,
    "currency": "USD"
  },
  "images": [
    {
      "url": "/shop/private-tile-drop.jpg",
      "alt": "Private tile drop placeholder"
    }
  ],
  "story": "This stays hidden from the public catalog so the status visibility rules are explicit in the codebase.",
  "shippingProfile": "pickup-only",
  "status": "private",
  "leadTimeNote": "Protected release only."
}
